{
  "schemaVersion": 1,
  "kind": "system_catalog_resilience",
  "owner": "repo:systemkatalog",
  "catalogRole": "canonical_stable_resilience_semantics",
  "updatedAt": "2026-09-21",
  "defaultCriticality": "unknown",
  "criticalityClasses": [
    "foundational",
    "essential",
    "supporting",
    "optional",
    "unknown"
  ],
  "couplingClasses": [
    "synchronous-blocking",
    "asynchronous-durable",
    "asynchronous-lossy",
    "observational",
    "manual",
    "unknown"
  ],
  "failurePolicies": [
    "block",
    "queue",
    "degrade",
    "fallback",
    "ignore",
    "unknown"
  ],
  "authorityDirections": [
    "from-to",
    "to-from",
    "bidirectional",
    "none",
    "unknown"
  ],
  "recoveryIndependenceClasses": [
    "independent",
    "partially-shared",
    "same-failure-domain",
    "unknown"
  ],
  "failureDomains": [
    {
      "id": "human:alexander",
      "kind": "human",
      "meaning": "Human sense, approval and abort authority.",
      "doesNotEstablish": [
        "current failure",
        "current health",
        "automatic execution authority"
      ]
    },
    {
      "id": "host:heim-pc",
      "kind": "host",
      "meaning": "The primary local operator host and its user-scoped state.",
      "doesNotEstablish": [
        "current failure",
        "current health",
        "automatic execution authority"
      ]
    },
    {
      "id": "host:wg-prod-1",
      "kind": "host",
      "meaning": "The current Weltgewebe production reference host or cell.",
      "doesNotEstablish": [
        "current failure",
        "current health",
        "automatic execution authority"
      ]
    },
    {
      "id": "identity:github",
      "kind": "identity",
      "meaning": "GitHub repository, branch, pull-request and review identity.",
      "doesNotEstablish": [
        "current failure",
        "current health",
        "automatic execution authority"
      ]
    },
    {
      "id": "provider:github",
      "kind": "provider",
      "meaning": "GitHub-hosted collaboration, CI control and repository metadata.",
      "doesNotEstablish": [
        "current failure",
        "current health",
        "automatic execution authority"
      ]
    },
    {
      "id": "network:public-internet",
      "kind": "network",
      "meaning": "External network reachability required for hosted services and public endpoints.",
      "doesNotEstablish": [
        "current failure",
        "current health",
        "automatic execution authority"
      ]
    },
    {
      "id": "credentials:operator",
      "kind": "credentials",
      "meaning": "Operator-held credentials required for authenticated mutation or recovery.",
      "doesNotEstablish": [
        "current failure",
        "current health",
        "automatic execution authority"
      ]
    },
    {
      "id": "provider:backup-storage",
      "kind": "provider",
      "meaning": "Backup storage and restore inputs outside the active primary data path.",
      "doesNotEstablish": [
        "current failure",
        "current health",
        "automatic execution authority"
      ]
    },
    {
      "id": "data:bureau-state",
      "kind": "data",
      "meaning": "Bureau operational SQLite state, envelopes, claims and receipts.",
      "doesNotEstablish": [
        "current failure",
        "current health",
        "automatic execution authority"
      ]
    },
    {
      "id": "control:grabowski-runtime",
      "kind": "control",
      "meaning": "Grabowski deployment, operator service, tunnel and typed execution surface.",
      "doesNotEstablish": [
        "current failure",
        "current health",
        "automatic execution authority"
      ]
    },
    {
      "id": "data:grabowski-outbox",
      "kind": "data",
      "meaning": "Durable local outbox used when downstream event delivery is unavailable.",
      "doesNotEstablish": [
        "current failure",
        "current health",
        "automatic execution authority"
      ]
    },
    {
      "id": "data:chronik-store",
      "kind": "data",
      "meaning": "Chronik append-only event data and integrity metadata.",
      "doesNotEstablish": [
        "current failure",
        "current health",
        "automatic execution authority"
      ]
    },
    {
      "id": "data:weltgewebe-postgresql",
      "kind": "data",
      "meaning": "Weltgewebe relational authority stored in PostgreSQL.",
      "doesNotEstablish": [
        "current failure",
        "current health",
        "automatic execution authority"
      ]
    },
    {
      "id": "stream:weltgewebe-jetstream",
      "kind": "stream",
      "meaning": "Weltgewebe durable event and stream state in JetStream.",
      "doesNotEstablish": [
        "current failure",
        "current health",
        "automatic execution authority"
      ]
    },
    {
      "id": "runtime:repoground",
      "kind": "runtime",
      "meaning": "The canonical RepoGround runtime and service identity.",
      "doesNotEstablish": [
        "current failure",
        "current health",
        "automatic execution authority"
      ]
    }
  ],
  "systems": [
    {
      "system": "actor:alexander",
      "criticality": "foundational",
      "failureDomains": [
        "human:alexander"
      ],
      "recoveryModeRefs": [],
      "acceptedSinglePathRisks": [
        "Human meaning, approval and abort authority intentionally have no automatic replacement."
      ],
      "evidence": [
        "docs/audits/heimgewebe-resilience-gap-matrix-v1.md",
        "registry/ecosystem/authority-matrix.v1.json"
      ],
      "uncertainty": 0.18
    },
    {
      "system": "artifact:ecosystem-map",
      "criticality": "optional",
      "failureDomains": [],
      "recoveryModeRefs": [],
      "acceptedSinglePathRisks": [],
      "evidence": [
        "docs/audits/heimgewebe-resilience-gap-matrix-v1.md",
        "registry/ecosystem/authority-matrix.v1.json"
      ],
      "uncertainty": 0.18
    },
    {
      "system": "repo:systemkatalog",
      "criticality": "essential",
      "failureDomains": [
        "identity:github",
        "provider:github"
      ],
      "recoveryModeRefs": [],
      "acceptedSinglePathRisks": [
        "The catalog can be reconstructed from verified Git clones, but no system-specific recovery mode is yet catalogued and hosted collaboration still depends on GitHub."
      ],
      "evidence": [
        "docs/audits/heimgewebe-resilience-gap-matrix-v1.md",
        "registry/ecosystem/authority-matrix.v1.json"
      ],
      "uncertainty": 0.18
    },
    {
      "system": "repo:bureau",
      "criticality": "foundational",
      "failureDomains": [
        "host:heim-pc",
        "data:bureau-state",
        "identity:github",
        "credentials:operator",
        "provider:backup-storage"
      ],
      "recoveryModeRefs": [
        "bureau-state-restore"
      ],
      "acceptedSinglePathRisks": [],
      "evidence": [
        "docs/audits/heimgewebe-resilience-gap-matrix-v1.md",
        "registry/ecosystem/authority-matrix.v1.json"
      ],
      "uncertainty": 0.18
    },
    {
      "system": "repo:grabowski",
      "criticality": "foundational",
      "failureDomains": [
        "host:heim-pc",
        "control:grabowski-runtime",
        "credentials:operator",
        "network:public-internet",
        "provider:backup-storage",
        "data:grabowski-outbox"
      ],
      "recoveryModeRefs": [
        "grabowski-release-rollback",
        "grabowski-state-restore",
        "chronik-durable-outbox"
      ],
      "acceptedSinglePathRisks": [],
      "evidence": [
        "docs/audits/heimgewebe-resilience-gap-matrix-v1.md",
        "registry/ecosystem/authority-matrix.v1.json"
      ],
      "uncertainty": 0.18
    },
    {
      "system": "repo:commonthing",
      "criticality": "essential",
      "failureDomains": [
        "host:wg-prod-1",
        "data:weltgewebe-postgresql",
        "stream:weltgewebe-jetstream",
        "network:public-internet",
        "credentials:operator",
        "provider:backup-storage"
      ],
      "recoveryModeRefs": [
        "weltgewebe-postgresql-restore",
        "weltgewebe-jetstream-recovery"
      ],
      "acceptedSinglePathRisks": [],
      "evidence": [
        "docs/audits/heimgewebe-resilience-gap-matrix-v1.md",
        "registry/ecosystem/authority-matrix.v1.json"
      ],
      "uncertainty": 0.18
    },
    {
      "system": "repo:repoground",
      "criticality": "supporting",
      "failureDomains": [
        "host:heim-pc",
        "runtime:repoground"
      ],
      "recoveryModeRefs": [
        "repoground-release-rollback"
      ],
      "acceptedSinglePathRisks": [],
      "evidence": [
        "docs/audits/heimgewebe-resilience-gap-matrix-v1.md",
        "registry/ecosystem/authority-matrix.v1.json"
      ],
      "uncertainty": 0.18
    },
    {
      "system": "repo:reposkop",
      "criticality": "unknown",
      "failureDomains": [
        "identity:github",
        "provider:github"
      ],
      "recoveryModeRefs": [],
      "acceptedSinglePathRisks": [],
      "evidence": [
        "docs/audits/heimgewebe-resilience-gap-matrix-v1.md"
      ],
      "uncertainty": 1.0
    },
    {
      "system": "repo:labor",
      "criticality": "optional",
      "failureDomains": [
        "identity:github",
        "provider:github"
      ],
      "recoveryModeRefs": [],
      "acceptedSinglePathRisks": [],
      "evidence": [
        "docs/audits/heimgewebe-resilience-gap-matrix-v1.md",
        "registry/ecosystem/authority-matrix.v1.json"
      ],
      "uncertainty": 0.18
    },
    {
      "system": "repo:alpha-lab",
      "criticality": "optional",
      "failureDomains": [
        "identity:github",
        "provider:github"
      ],
      "recoveryModeRefs": [],
      "acceptedSinglePathRisks": [],
      "evidence": [
        "registry/ecosystem/source-bindings.v1.json",
        "registry/ecosystem/component-admissions.v1.json"